{
  "$schema": "http://json-schema.org/draft-07/schema#",
  "$id": "https://earnie.local/components.schema.json",
  "title": "Earnie Komponenten (Batterie, PV & Wechselrichter)",
  "description": "JSON-Schema für components.json — inverters[], batteries[], pv_systems[] (Szenario wählt battery_ids[] / pv_system_ids[]; Inverter folgen aus inverter_id).",
  "type": "object",
  "properties": {
    "$schema": {
      "type": "string",
      "description": "Verweis auf diese Schema-Datei für Editor-Hilfen."
    },
    "inverters": {
      "type": "array",
      "description": "Wechselrichter (2.7.l); PV und Batterien referenzieren via inverter_id.",
      "items": {
        "$ref": "#/definitions/inverter_entity"
      }
    },
    "batteries": {
      "type": "array",
      "description": "Batteriespezifikationen (Mehrfach-Definition; Szenario wählt battery_ids[]).",
      "items": {
        "$ref": "#/definitions/battery_entity"
      }
    },
    "pv_systems": {
      "type": "array",
      "description": "PV-Anlagen (Mehrfach-Definition; Szenario wählt pv_system_ids[]).",
      "items": {
        "$ref": "#/definitions/pv_system_entity"
      }
    },
    "earnie_data_model": {
      "type": "integer",
      "const": 4,
      "description": "Earnie data-model version for config pack import/export."
    }
  },
  "definitions": {
    "battery_wear": {
      "type": "object",
      "description": "Verschleißkosten für Batterie-Durchsatz (Laden + Entladen) in der MILP-Zielfunktion.",
      "required": [
        "enabled"
      ],
      "properties": {
        "enabled": {
          "type": "boolean",
          "description": "false = kein Verschleiß-Term; true = Parameter unten erforderlich."
        },
        "replacement_cost_euro": {
          "type": "number",
          "exclusiveMinimum": 0,
          "description": "Ersatzkosten der Batterie in Euro."
        },
        "expected_cycles": {
          "type": "number",
          "exclusiveMinimum": 0,
          "description": "Angenommene Vollzyklen bis Ersatz."
        },
        "cycle_cost_fraction": {
          "type": "number",
          "exclusiveMinimum": 0,
          "maximum": 1,
          "description": "Anteil der Ersatzkosten, der zyklenbedingt ist."
        }
      }
    },
    "battery_entity": {
      "type": "object",
      "description": "Hausbatterie oder Powerstation (2.7.g/h); nicht E-Auto — siehe flexible_consumers.",
      "required": [
        "id",
        "battery_capacity_kwh",
        "battery_efficiency",
        "battery_min_soc",
        "battery_max_soc"
      ],
      "properties": {
        "id": {
          "type": "string"
        },
        "label": {
          "type": "string"
        },
        "type": {
          "type": "string",
          "enum": ["house", "powerstation"],
          "default": "house",
          "description": "house = Multi-ESS Hausspeicher; powerstation = single_use / standby_backup Reserve (2.7.g/h)."
        },
        "backing": {
          "type": "string",
          "enum": ["virtual", "physical"],
          "description": "Nur type=powerstation: virtual = Carve-out im Multi-ESS; physical = One-Way-Pack."
        },
        "role": {
          "type": "string",
          "enum": ["single_use", "standby_backup"],
          "description": "Nur type=powerstation: single_use (2.7.g) oder standby_backup (2.7.h)."
        },
        "attached_consumer_ids": {
          "type": "array",
          "items": { "type": "string" },
          "description": "Nur type=powerstation: angeschlossene manuelle Verbraucher (virtual: mehrere; physical: höchstens einer)."
        },
        "attached_consumer_id": {
          "type": "string",
          "description": "Deprecated alias: erstes Element von attached_consumer_ids (Kompatibilität)."
        },
        "battery_capacity_kwh": {
          "type": "number",
          "exclusiveMinimum": 0
        },
        "battery_max_power_kw": {
          "type": "number",
          "exclusiveMinimum": 0,
          "description": "Deprecated (2.7.j): single max for both directions; migrate to charge/discharge fields."
        },
        "battery_max_charge_power_kw": {
          "type": "number",
          "exclusiveMinimum": 0,
          "description": "Max charge power (kW). Prefer over battery_max_power_kw."
        },
        "battery_max_discharge_power_kw": {
          "type": "number",
          "exclusiveMinimum": 0,
          "description": "Max discharge power (kW). Prefer over battery_max_power_kw."
        },
        "limits_from_live": {
          "type": "boolean",
          "default": false,
          "description": "When true, live get_ess_* telemetry overrides HK SOC/power ceilings (fallback HK if unmapped)."
        },
        "battery_efficiency": {
          "type": "number",
          "exclusiveMinimum": 0,
          "maximum": 1,
          "description": "One-way chemistry factor η_batt (0–1]. Path η_path = η_inv · η_batt; round-trip ≈ η_path²."
        },
        "battery_min_soc": {
          "type": "number",
          "minimum": 0,
          "maximum": 100
        },
        "battery_max_soc": {
          "type": "number",
          "minimum": 0,
          "maximum": 100
        },
        "threshold_power": {
          "type": "number",
          "exclusiveMinimum": 0,
          "maximum": 1,
          "description": "Relativer Anteil von max(charge, discharge) kW (Standard 0.02)."
        },
        "standby_power_kw": {
          "type": "number",
          "minimum": 0,
          "description": "Dauerhafte AC-Eigenleistung der Batterie (kW), 24/7 als Verbrauch."
        },
        "inverter_id": {
          "type": "string",
          "description": "Reference to inverters[].id (required for house batteries and physical powerstations; omit for virtual powerstations)."
        },
        "control": {
          "type": "string",
          "enum": ["full", "limits_only", "read_only"],
          "default": "full",
          "description": "Steuerbarkeit: full = Zwangsladen/-entladen; limits_only = nur Lade-/Entladegrenzen; read_only = Eigenverbrauch ohne Setpoints."
        },
        "regulates_on": {
          "type": "string",
          "enum": ["grid", "none"],
          "description": "Required for type=house: which measurement the device's own controller uses when Earnie does not force it (grid = root meter / self-consumption; none = pure setpoint follower). Forbidden on powerstations."
        },
        "ehal_bindings": {
          "type": "object",
          "description": "entity-scoped ESS bindings (2.7.c): keys ess.{slug}.sens_ess_soc / set_ess_* / get_ess_*; values are Merker titles or HA entity ids.",
          "additionalProperties": {
            "type": "string"
          }
        },
        "id_locked": {
          "type": "boolean",
          "description": "When true, id is frozen (EHAL slug). Missing ⇒ locked (legacy). New entities start false until Bezeichnung leaves id_provisional_label."
        },
        "id_provisional_label": {
          "type": "string",
          "description": "Seed Bezeichnung while id_locked is false; first differing save sets id from label and locks."
        },
        "battery_wear": {
          "$ref": "#/definitions/battery_wear",
          "description": "Verschleißmodell dieser Batterie."
        }
      }
    },
    "pv_system_entity": {
      "type": "object",
      "description": "PV-Anlage für Prognose und Backtesting.",
      "required": [
        "id",
        "kwp"
      ],
      "properties": {
        "id": {
          "type": "string"
        },
        "label": {
          "type": "string"
        },
        "kwp": {
          "type": "number",
          "exclusiveMinimum": 0
        },
        "pv_tilt": {
          "type": "number",
          "description": "Neigung in Grad."
        },
        "pv_azimuth": {
          "type": "number",
          "description": "0=Süd, -90=Ost, 90=West."
        },
        "id_locked": {
          "type": "boolean",
          "description": "When true, id is frozen. Missing ⇒ locked (legacy). New entities start false until Bezeichnung leaves id_provisional_label."
        },
        "id_provisional_label": {
          "type": "string",
          "description": "Seed Bezeichnung while id_locked is false; first differing save sets id from label and locks."
        },
        "inverter_id": {
          "type": "string",
          "description": "Reference to inverters[].id (required)."
        },
        "ehal_bindings": {
          "type": "object",
          "description": "entity-scoped pv.{id}.* bindings (optional live PV power).",
          "additionalProperties": { "type": "string" }
        }
      }
    },
    "inverter_entity": {
      "type": "object",
      "description": "Wechselrichter (2.7.l): PV×Batterie-Topologie, Clipping, island vs grid-tied.",
      "required": ["id", "type", "ac_connection", "efficiency"],
      "properties": {
        "id": { "type": "string" },
        "label": { "type": "string" },
        "type": {
          "type": "string",
          "enum": ["hybrid", "pv_string", "battery"],
          "description": "hybrid = PV+battery DC; pv_string = PV only; battery = AC-coupled battery inverter."
        },
        "ac_connection": {
          "type": "string",
          "enum": ["grid_tied", "island"],
          "description": "grid_tied = house AC bus; island = attached loads only (replaces batteries[].kind=isolated)."
        },
        "efficiency": {
          "type": "number",
          "exclusiveMinimum": 0,
          "maximum": 1,
          "description": "One-way DC↔AC factor η_inv (0–1]. Applied to PV DC→AC and as part of ESS path η_inv·η_batt."
        },
        "max_ac_power_kw": {
          "type": "number",
          "exclusiveMinimum": 0,
          "description": "AC clipping + discharge cap; absent = no cap."
        },
        "max_pv_input_kw": {
          "type": "number",
          "exclusiveMinimum": 0,
          "description": "Optional DC/MPPT input cap."
        },
        "max_ac_charge_kw": {
          "type": "number",
          "exclusiveMinimum": 0,
          "description": "Optional grid-charge through inverter cap."
        },
        "control": {
          "type": "string",
          "enum": ["full", "limits_only", "read_only"],
          "default": "full"
        },
        "regulates_on": {
          "type": "string",
          "enum": ["grid", "none"],
          "description": "Optional: which measurement the inverter's own controller uses (e.g. dynamic feed-in limiter on grid). Absent ≡ none for live loop count."
        },
        "owned_by": {
          "type": "string",
          "description": "Battery id that owns this built-in inverter (UI/lifecycle only)."
        },
        "ehal_bindings": {
          "type": "object",
          "description": "entity-scoped inv.{id}.* bindings.",
          "additionalProperties": { "type": "string" }
        },
        "id_locked": { "type": "boolean" },
        "id_provisional_label": { "type": "string" }
      }
    }
  }
}
