{
    "$schema": "./components.schema.json",
    "earnie_data_model": 4,
    "inverters": [
        {
            "id": "wr_main",
            "label": "Haupt-Wechselrichter",
            "type": "hybrid",
            "ac_connection": "grid_tied",
            "control": "full",
            "ehal_bindings": {
                "inv.wr_main.sens_inv_power_pv": "",
                "inv.wr_main.set_inv_ac_power_limit": ""
            },
            "efficiency": 0.97
        }
    ],
    "batteries": [
        {
            "id": "default_5kwh",
            "label": "5 kWh Speicher",
            "inverter_id": "wr_main",
            "battery_capacity_kwh": 5.0,
            "battery_max_charge_power_kw": 2.5,
            "battery_max_discharge_power_kw": 2.5,
            "battery_efficiency": 1.0,
            "battery_min_soc": 10.0,
            "battery_max_soc": 100.0,
            "threshold_power": 0.05,
            "limits_from_live": false,
            "control": "full",
            "regulates_on": "grid",
            "ehal_bindings": {
                "ess.default_5kwh.sens_ess_soc": "",
                "ess.default_5kwh.sens_ess_power": "",
                "ess.default_5kwh.set_ess_charge_power_limit": "",
                "ess.default_5kwh.set_ess_discharge_power_limit": "",
                "ess.default_5kwh.set_ess_active_power": ""
            },
            "battery_wear": {
                "enabled": true,
                "replacement_cost_euro": 1500,
                "expected_cycles": 6000,
                "cycle_cost_fraction": 0.5
            }
        },
        {
            "id": "upgrade_10kwh",
            "label": "10 kWh Speicher",
            "inverter_id": "wr_main",
            "battery_capacity_kwh": 10.0,
            "battery_max_charge_power_kw": 5.0,
            "battery_max_discharge_power_kw": 5.0,
            "battery_efficiency": 1.0,
            "battery_min_soc": 10.0,
            "battery_max_soc": 100.0,
            "threshold_power": 0.02,
            "limits_from_live": false,
            "control": "full",
            "regulates_on": "grid",
            "ehal_bindings": {
                "ess.upgrade_10kwh.sens_ess_soc": "",
                "ess.upgrade_10kwh.sens_ess_power": "",
                "ess.upgrade_10kwh.set_ess_charge_power_limit": "",
                "ess.upgrade_10kwh.set_ess_discharge_power_limit": "",
                "ess.upgrade_10kwh.set_ess_active_power": ""
            },
            "battery_wear": {
                "enabled": true,
                "replacement_cost_euro": 3000,
                "expected_cycles": 6000,
                "cycle_cost_fraction": 0.5
            }
        }
    ],
    "pv_systems": [
        {
            "id": "roof_south",
            "label": "Dach Süd 10 kWp",
            "kwp": 10,
            "pv_tilt": 25,
            "pv_azimuth": 0,
            "inverter_id": "wr_main",
            "ehal_bindings": {}
        }
    ]
}
